{
  "id": "graalvm",
  "name": "graalvm",
  "version": "0.1.0",
  "description": "Installs GraalVM distribution for polyglot and native-image support",
  "options": {
    "graalvm_version": {"type": "string", "default": "22.3.1", "description": "GraalVM release to install"},
    "install_native_image": {"type": "boolean", "default": true}
  }
}
