{
  "id": "kotlin",
  "name": "kotlin",
  "version": "0.1.0",
  "description": "Installs Kotlin tooling and optional Kotlin kernel (kotlin-jupyter)",
  "options": {
    "install_kotlin_compiler": {"type": "boolean", "default": true},
    "install_kotlin_kernel": {"type": "boolean", "default": false}
  }
}
