{
  "name": "zsh-config",
  "version": "0.1.0",
  "id": "zsh-config",
  "description": "Installs Prezto and configures Powerlevel10k for the dev user",
  "options": {
    "prezto_repo": {
      "type": "string",
      "default": "https://github.com/sorin-ionescu/prezto.git",
      "description": "Prezto repo to clone"
    }
  }
}
